id,titulo,descricao,status,data
392,Ressarcimento,"Moro na comunidade pavão - pavãozinho, desde sempre a light nunca instalou um relógio na minha casa, mesmo realizando pedido, entã",Respondida,Há 7 dias
393,"SEM ACORDO, SEM CANCELAMENTO ""PROTESTADO SEM NOTIFICAÇÃO"".",O IMÓVEL ESTÁ FECHADO! DEPOIS DE TER VÁRIAS COBRANÇAS [Editado pelo Reclame Aqui] SEM RESOLVEREM O MEU PROBLEMA COM TOTAL FALTA DE,Respondida,Há 7 dias
394,Não consigo pagar,"Estou com uma dívida e não consigo pagar, 49 reais e desconheço a dívida",Respondida,Há 7 dias
395,Falta de energia em uma das fases,Minha residência está semanas sem luz em uma das fases. Ligo e abro o chamado na light e sem ninguém aparecer no local. Eles fecha,N/A,Há 7 dias
396,Realocação de medidor não respondida,Solicitei a realocação no dia 21/01 já com o padrão solicitado preparado e me foi dado o prazo de até o dia 26/01 para comparecere,Respondida,Há 8 dias
397,Light Deixa Cliente sem Energia e gera prejuizo,Boa noite.Desde ontem 25/01/24 por volta das 23:30 uma fase do disjuntor trifasico caiu e a energia esta oscilando e causand,N/A,Há 8 dias
398,Oscilação de fases e quedas de energia constantes,"Minha residência tem um relógio trifásico e está com oscilações de energia elétrica, com isso, tenho sofrido quedas constantes de",Respondida,Há 8 dias
399,Oscilação na rede.,"Abri uma reclamação na empresa e até agora ninguém veio solucionar o problema. As quedas de energia continuam, é preciso desligar",N/A,Há 8 dias
400,Conta de luz exorbitante de alta !,"Recebi minha conta de luz e vi o absurdo que veio de luz! 1,263,16!! 1 ar condicionado, 1 geladeira nova, 1 máquina de lavar, 1 ve",Respondida,Há 8 dias
401,Falta de energia,"Bem no dia 18 de Janeiro 2024 começamos a ter problemas com falta de energia qu durou até o dia 22, por várias vezes nesse período",Respondida,Há 8 dias
402,Curto externo no fio que leva eletricidade ao relógio da casa.,Houve curto e princípio de incêndio no fio que leva eletricidade da minha casa.Esse incidente aconteceu na segunda-feira dia 22 de,Respondida,Há 8 dias
403,Não comparecimento da equipe para vistoria,"Em uma última reclamação (ID*******), explicamos sobre um período desse mês de Janeiro, que o CPF responsável pela conta de luz, n",Respondida,Há 8 dias
404,LIGHT NAO VEM RESOLVER CABO TRIFASICO ARRIADO E PARTIDO,Na quinta-feira (25/01/2024) as 06:06 da manha abrir uma chamado para light por conta de um inicio de incendio na fiação de um pos,Respondida,Há 8 dias
405,Nova ligação,"Estou a dias tentando solicitar uma nova ligação na minha residência, na data de hoje verifiquei pelo site que foi reprovado, poré",Respondida,Há 8 dias
406,Queda de luz constante,"Desde a madrugada do dia 25, estou sofrendo com constantes quedas de energia na minha região, já fiz reclamações na ouvidoria da e",Respondida,Há 8 dias
407,Não consigo fazer a troca de titularidade,"Já tentei por diversas vezes realizar a troca de titularidade da conta da light para o meu novo imóvel. O site é muito ruim, cai o",Respondida,Há 8 dias
408,Prazo Troca de titularidade e religação de energia,"Solicitei a troca de titularidade da conta e o prazo que me passaram são 3 dias úteis, só pra trocar o nome da conta e mais 1 dia",Respondida,Há 8 dias
409,Idosa pensionista sem plano de saúde,"Minha mãe idosa de 79 anos, com vários problemas de saúde,pensionista do plano oferecido pela Light, atualmente Amil. Em dezembro",Respondida,Há 8 dias
410,URGENTE EQUIPE - RISCO DE ACIDENTE - FIOS PARTIDOS,URGENTE EQUIPE - RISCO DE ACIDENTE - FIOS PARTIDOSTerça dia 23/01/24 a tarde devido a muita chuva houve um estouro em,Respondida,Há 8 dias
411,Solciitação de parecer de acesso nao atendido,"Foi dado entrada no parecer de acesso no dia 18/01 e até agora não foi atendida.fui informado que entraria em tratativa, mas",Respondida,Há 8 dias
412,Orçamento de conexão nao enviado - Leila,No dia 6 de Janeiro foi recebido um protocolo******* referente ao recebimentos de todos os documentos necessarios para micro geraç,Respondida,Há 8 dias
413,"Quedas de energia, eletrodoméstico queimado !","Boa tarde!Estamos enfrentando problemas com os frequentes cortes de energia da Light, o que tem sido bastante desafiad",Respondida,Há 8 dias
414,Ressarcimento Danos elétricos,"Dei entrada na documentação exigida para ressarcimento de danos elétricos, e no dia 19/01/24, sexta feira as 15:50h, recebi email",Respondida,Há 8 dias
415,"Light está cobrando taxa indevidamente, agindo de maneira duvidosa .",Quem mora na ilha do governador vem sofrendo todo esse mês de janeiro com a prestação de serviços da light . Apagões que duram dia,Respondida,Há 8 dias
416,"SERVIÇO MAL FEITO, FIO EMENDADO DO QUADRO AO POSTE","FOI FEITO UM TRABALHO MAL FEITO, ""PORCO"", PERIGOSO; UMA EMENDA DO FIO QUE VAI DO QUADRO DE DISTRIBUIÇÃO AO POSTE DA LIGH",Respondida,Há 8 dias
417,Falta de energia,"Ontem dia 25/01 teve alguns picos de luz, ao chegar do trabalho me deparei com a geladeira queimada. Moro com meu avô de idade e",Respondida,Há 8 dias
418,Comércio com mas de 15 dias sem fase 220v,"Boa tarde , estou a quase 20 dias sem a fase 220v no meu comércio. Já fiz a solicitação mais de 15 vezes tenho vários protocolo",Respondida,Há 8 dias
419,Descaso total com o cliente,Estou sem luz há quase 3 dias. A primeira reclamação foi no dia 23/01/24 por volta das 14:30 quando ficamos sem luz. Desde então f,N/A,Há 8 dias
420,Negociação,"Boa tarde, mais uma vez essa empresa vem me dando dor de cabeça. Não consigo realizar a negociação pelos canais oficiais e com iss",N/A,Há 8 dias
421,FALTA DE LUZ HÁ 6 DIAS,"Estou tentando entrar em contato com a empresa para solicitar reparo, mas os funcionários ao saber do motivo encerram a chamada, q",Respondida,Há 8 dias
422,Light enviando para Serasa nomes de clientes adimplentes,"Minha conta da Light está em débito automático há 12 anos. Conta de janeiro venceu no dia 4 de janeiro. Segundo o Banco Itaú, a Li",Respondida,Há 8 dias
423,Light me cadastrou indevidamente no Serasa!,À Equipe Light!Minhas contas de luz estão cadastradas há anos em débito automático.Fui supreendida com car,Respondida,Há 8 dias
424,Falta de luz,"Dia 20 desse mês de Janeiro, pegoufogo no poste e fiquei sem luz. Acontece que liguei várias vezes. Mandaram 3 equipes que não po",N/A,Há 8 dias
425,"Apesar da minha conta da Light ser débito automático, recebi carta do Serasa, pois a Light mandou meu nome pra eles. Como pode ????","Minha conta de energia elétrica da Light, é em débito automático e não entendi o porque a Light mandou o meu nome para o Serasa, r",Respondida,Há 8 dias
426,Pedido de alteração de carga desde 13/11/2023,"Desde 13/11/2023 eu venho fazendo diversas solicitações para atender o pedido de alteração de carga, desde troca de titularidade,",Respondida,Há 8 dias
427,Rede elétrica envolvida em árvore,"Bom dia então, estamos constantemente ficando sem energia elétrica devido enfrente a minha residência ter uma árvore que está env",Respondida,Há 8 dias
428,VENTILADOR DE TETO DANIFICADO COM A FALTA DE LUZ,"Prezado, bom dia!Devido a falta de energia nos dias 17/01/2024 até o dia 20/01/2024 ( SEM UMA FASE NO CONDOMÍNIO TUDO",Respondida,Há 8 dias
429,CORTE INTERMITENTE DE ENERGIA,Como já relatei anteriormente os cortes/retorno de energia continuam acontecendo.Só como exemplo dia 24/01/34 exatamente às,N/A,Há 8 dias
430,Créditos de energia gerados pelo sistema de microgeração não foi abatido na conta de mesmo CPF já cadastrada para usar os créditos.,Estou usando essa plataforma pois o fale conosco da lightestá com erro 404. Solicito a contestação da conta de JAN/24 cód. Instala,Respondida,Há 8 dias
431,leitura de relógio que está todo escuro no leitor,"Gostaria de saber como a light está me cobrando R$ 759,01 de conta de energia baseada em que leitura tendo em vista que já abri ch",Respondida,Há 8 dias
432,Queda de energia recorrente e falta de transparência da empresa,"Moro na Tijuca e de dezembro para cá frequentemente temos ficado sem energia no prédio. Na última segunda-feira (22/01), tiv",Respondida,Há 8 dias
433,falta de energia,"Moro Na Praia do Cardo em Sepetiba no final da rua, Rio de Janeiro, RJ. E quero reclamar novamente pelas constantes faltas de ener",Respondida,Há 8 dias
434,Comprovante de pagamento - não cortem minha luz,Bom diaAcabei de realizar o pagamento de uma conta em atraso pelo cartão de crédito mas ainda não compensouSegue compr,Respondida,Há 8 dias
435,Falta de luz a mais de 24 horas,"Dia 24/01/2024 por volta de 20hs, um caminhão passou e arrebentou o fio de energia, deixando o fio energia do jogado no chão , lig",Respondida,Há 8 dias
436,Renegociação,"Bom dia ,gostaria de tá fazendo uma renegociação com a Ligth, pois fiquei com dificuldade de tá pagando as duas últimas contas ,so",Respondida,Há 8 dias
437,"NÃO FAZEM RESET DO MEU CADASTRO, MEU NOME ESTÁ ERRADO","Já pedi algumas várias vezes o reset do meu cadastro E ELES NÃO FAZEM. Nem meu nome, meu telefone ou email estão certos e estou im",Respondida,Há 8 dias
438,Atendimento ao cliente,"Bom dia !Tenho tido vários problemas com a consecionaria de light, uma que me acusaram de furto de energia sem eu ter feito",Respondida,Há 8 dias
439,Corte Indevido de energia pela Ligth,"Uma equipe da Ligth veio ao condomínio desligar a energia de alguns apartamentos inadimplentes! No entanto, desligaram o meu també",Respondida,Há 8 dias
440,Geladeira Quebrou com Pico de Luz,"Minha geladeira frost free Consul modelo CRM38NBANA parou de congelar, o que constatei no sábado, 20/01/2024 após mais de uma sema",Respondida,Há 8 dias
441,SEM ENERGIA ELETRICA,"Foram 4 dias com transformador pegando fogo, ate que vieram trocar o transformador, mas continuou com problema e vieram no dia seg",Respondida,Há 8 dias
442,Irregularidades com equipe técnica,"Boa noiteEstou aqui já que estou a seis dias sem luz, por motivo que não sei. Ligo para a empresa light para mandar uma equi",Respondida,Há 8 dias
443,Desvincular imail,"Bn , não consigo desvincular meu imail de uma conta , onde não tenho mais , e hj estou com uma conta em meu nome e não consigo ace",Respondida,Há 9 dias
444,Gostaria de negociar o débito em atraso,"Estou tentando fazer um acordo do débito que tenho junto a empresa e não consigo, gostaria de esclarecer que recebo pelo loas e pr",Respondida,Há 9 dias
445,Sem eletricidade no imóvel há mais de 1 mes,"Estou tentando solicitar a religação do serviço desde dezembro/2023. Já liguei, fui diversas vezes na light e não vieram religar.",Respondida,Há 9 dias
446,Reset de senha,Estou a dias tentando acessar o site ou aplicativo da empresa. eu tenho cadastro/ tenho código cliente e não consigo prq diz que,Respondida,Há 9 dias
447,Queda de energia,"Queda de energia constante na Av. Amado baía, Taquara/Jacarepaguá e não há uma assistência, uma vista técnica no local. As mais re",Respondida,Há 9 dias
448,Light não emite a conta de luz,No dia 25/11/2023 foi solicitado que houvesse uma troca de titularidade referente ao imóvel cuja instalação é*******. A troca foi,Respondida,Há 9 dias
449,Light Cobra conta em duplicidade,A light está me cobrando uma conta de energia que já foi paga via pix. Já colocou meu nome no SPC. Não consigo contato com a empre,Respondida,Há 9 dias
450,Conta discordando,"Desde do dia 14/12 estou fora de casa por causa da carga elétrica da light, com esses picos de luz meu prédio ocorreu um incêndio",Respondida,Há 9 dias
451,Valores auto de 2 meses ..,Tô tendo muito dor de cabeça com a light dês de novembro e nada de resolver meu problema só falam que as leituras estão certas até,Respondida,Há 9 dias
452,Conta Paga,Efetuei o pagamento da minha conta de Dezembro em 29 de Novembro. Hoje no dia 25 de Janeiro cortaram minha conta alegando que eu e,Respondida,Há 9 dias
453,Número do medidor errado na conta de luz com valores absurdos,"Em uma casa que residem 2 pessoas que trabalham o dia inteiro na rua, chegam contas com valores absurdos, em média R$700,00, e par",Respondida,Há 9 dias
454,Troca de titularidade,"Estou tentando realizar a troca de titularidade para meu novo endereço, mas o sistema informa que possuo débitos em aberto. Já fiz",Respondida,Há 9 dias
455,Cobrança duplicada,"Solicitei o encerramento de um contrato por meio do Whatsapp da Light em Novembro de 2023, foi informado que deveria pagar o bolet",Respondida,Há 9 dias
456,Preciso passar um relógio pro meu nome tenho comorbidades,Não consigo pelo app e não tenho condições físicas no momento me deslocar preciso muito de ajuda pra resolver logo essa situação.,Respondida,Há 9 dias
457,Falta de luz,Estou há 3 doasse energia elétrica. Já fiz várias reclamações e nada é providenciado. Por último falei com a ouvidoria protocolos,N/A,Há 9 dias
458,Cobranças [Editado pelo Reclame Aqui],Efetuei a rescisão do meu contrato de aluguel no mês de janeiro de 2024 e fui surpreendido ao entrar no site da light para verific,Respondida,Há 9 dias
459,SEM LUZ,"Estou desde Novembro solicitando um suporte da light pois a fiação estava em risco, ontem dia 24/01/24 passou um caminhão e carreg",Respondida,Há 9 dias
460,Não tem agência na Barra,Não consigo transferir titularidade pelo site e não tem agência na Barra da Tijuca. Me despenquei até uma agência da Freguesia num,N/A,Há 9 dias
461,cobranças com a mesma data de vencimento,Gostaria de mencionar que não é a primeira vez que este fato me ocorre. Essa distribuidora de energia não mede a dor de seus clie,Respondida,Há 9 dias
462,Falta de energia há 4 dias,Estou solicitando há 4 dias o reestabelecimento de minha energia a light. Até o momento continuo sem luz. Tenho 2 crianças pequena,Respondida,Há 9 dias
463,"Troca de cep da conta de luz, cep errado.","Boa tarde, estou muito insasfeito, um simples problema que pode ser resolvido rapidamente. Eu liguei dia 24/01/2023 para a central",Respondida,Há 9 dias
464,Site não Funciona - Ligação Nova,Estou desde outubro de 2023 tentando solicitar uma ligação nova no meu apartamento.Por telefone somos direcionados ao,N/A,Há 9 dias
465,Dívida em protesto já paga,A light colocou uma dívida em protesto em cartório já paga minha.A conta foi paga num dia e mesmo assim no outro entrou em p,N/A,Há 9 dias
466,Aumento absurdo da conta,"A 1 ano atrás a Light falou que iria mudar o sistema! Tirou o relógio da minha casa ,na rua toda só a minha casa que não tem e col",Respondida,Há 9 dias
467,Não consigo acessar mais a minha conta,"Tento acessar a minha conta na Agencia Virtual pelo PC, como sempre fiz, não consigo de nenhuma forma. Já tentei pelo CPF, email,",N/A,Há 9 dias
468,"RESPEITO DA EMPRESA ""LIGHT"" COM A DATA DE VENCIMENTO","Bom dia!Solicitei uma troca de titularidade na loja da LIGHT localizada no Shopee Madureira em Outubro de 2023, ainda escolh",N/A,Há 9 dias
469,Tarifa social,Solicitei a tarifa social no dia 24 de novembro de 2023 e até hoje não obtive retorno. Apenas um protocolo de solicitação.,N/A,Há 9 dias
470,Parcelamento de fatura,"Preciso parcelar e pagar faturas que estão em atraso que o antigo inquilino do meu apartamento deixou em aberto no meu nome, não c",Respondida,Há 9 dias
471,"Falta de energia, contas todas pagas","Tenho 1 bebê de 1 ano, com as contas da light todas pagas em dias.Dia 14/01 ocorreu a primeira falta de energia somente no m",Respondida,Há 9 dias
472,Contestacao,"Aluguei uma loja comercial, onde por solicitação do proprietário da loja precisei ir a light para colocar as futuras contas em meu",Respondida,Há 9 dias
473,Falta de luz,Desde as 10h do dia 24/01/24 tento restabelecer a luz na minha residência. Falam que enviarão uma equipe que não chega nunca. Ligu,Respondida,Há 9 dias
474,Contas não entregues e valor indevido.,"As contas de luz não estão chegando no meu endereço, por muitas vezes tenho que ir no site/agência virtual para retirar uma segund",Respondida,Há 9 dias
475,Light Nao resolve problema s na pavuna,"Trabalho esquina da rua cicero17 , com avenida sargento de melicias 158 pavuna ta sem 1 fase a um mês.",Respondida,Há 9 dias
476,Meu relógio é trifásico e só entregam uma fase,"Estou há meses tentando reativar uma fase que eles mesmo cortaram pra fazer de neutro, já que um galho rompeu o neutro e ao invés",Respondida,Há 9 dias
477,negativação em meu CPF sem ser cliente light,"Estranhamente apontou uma negativação em meu banco, fui direcionado ao serasa na qual fui surpreendido por uma conta de 2023 da Li",Respondida,Há 9 dias
478,A Light não atende nem por telefone nemPor zap,Estou tentando reclamar do consumo cobrado indevidamente na minha conta e não consigo falar com a light. A gente liga e fica ouvin,Respondida,Há 9 dias
479,Protesto em Cartório,"Fiquei sabendo hoje em 2024, que vocês protestaram meu nome em cartório referente a uma fatura no valor de R$ 102,08 de 2021.",Respondida,Há 9 dias
480,FIZ O PAGAMENTO E LIGHT NÃO RELIGA,"Fiz o pagamento de 3 contas unificadas pelo proprio site da Light, a propria empresa emitiu um comprovante de pagamento e ao anexá",Respondida,Há 9 dias
481,Picos de energia,"Bom dia. Já fazem alguns meses que uma árvore vem criando transtornos na calçada da rua do governo entre os numeros 280 e 290, poi",Respondida,Há 9 dias
482,Cobrança abusiva,"Bom dia. Meu nome é *******masceno , cpf : *******.Solicito auxílio quanto a cobrança [Editado pelo Reclame Aqui] da minha p",N/A,Há 9 dias
483,Sem condições de pagar valor ta muito caro,"Então eu tentei fazer acordo so que não foi possível não aceitaram diminuir o valor das parcelas,eu não to na condições de pagar u",Respondida,Há 9 dias
484,Estou sem luz desde,"O poste da minha residência saiu uma faísca de fogo, acabando com a luz as 18h do dia 24/01/24. Entrei em contato com a light pel",Respondida,Há 9 dias
485,contestar o valor da conta de luz,"Estou tentando contestar o valor absurdo que veio na minha conta de luz e não consigo contato com a light, do Ano passando tava vi",Respondida,Há 9 dias
486,Denúncia,"Fiz uma denúncia na light de furto de energia onde o fio está passando junto ao meu,que pago minhas contas ..meu medo é este fio p",Respondida,Há 9 dias
487,Fis um acordo,Olá bom dia Então eu fiz um acordo para quitar meu débito junto a light pelo desenrola Brasil no dia 3/01/2024 contrato,Respondida,Há 9 dias
488,Sem luz a 12 dias,"Bom dia!!Gostaria de abrir uma reclamação pois já é a terceira vez que isso acontece, em dezembro fiquei 11 dias sem luz, de",Respondida,Há 9 dias
489,CONTA DE LUZ COM VALOR ALTISSIMO - LIGHT ESTA ME [Editado pelo Reclame Aqui],"Me mudei a pouco tempo para Vilar dos Teles, não tenho quase nenhum eletro, ambas as luzes ficam apagadas no meu apto. Moro sozinh",Respondida,Há 9 dias
490,Cobrança [Editado pelo Reclame Aqui],"Prezados,Em minha conta Ref Jan/2024 veio um valor que desconheço no valor de 65,82. Não encontrei nenhuma informação nos ca",Respondida,Há 9 dias
491,falta de energia,"Bom dia. estou ha 4 dias sem energia. abri vários protocolos e NINGUÉM resolveu o meu problema. no dia 23/01, um carro de placa **",Respondida,Há 9 dias
492,Poste na frnete da entrada da garagem,"Estamos com um problema na entrada do portão da vila,enta ocupando parte da passagem dos veículos dos moradores,já aconteceu diver",Respondida,Há 9 dias
493,Não consigo recuperar código do cliente,"Seus bando de vermes, toda hora sou deslogado do aplicativo e nunca consigo entrar mais, nunca consigo recuperar a senha porque pe",Respondida,Há 9 dias
494,Cobrança [Editado pelo Reclame Aqui] e Falta de Resolução pela Ligh,"Prezado,Venho por meio desta manifestar minha insatisfação e preocupação em relação aos serviços prestados pela Light,",N/A,Há 9 dias
495,Corte de luz com a conta paga !,Estou abrindo esta reclamação para exigir o retorno da minha luz que foi cortada no dia 23/01/2024 mesmo eu estando com a fatura p,Respondida,Há 9 dias
496,Pra variar não recebo a conta e sou multada,Mais uma vez não recebi minha conta de luz. Em quatro meses é a segunda vez!!! Apenas recebo um e-mail apontando o atraso. Para ap,Respondida,Há 10 dias
497,Visita do técnico da Light se comunicado prévio,O técnico da light esteve na minha residência sem comunicado prévio da Light para verificar o Relógio informando que consumo aum,Respondida,Há 10 dias
498,Fornecimento irregular de energia elétrica,"Desde o último domingo, 21/01/2024, na rua em que resido, as residências têm alguns cômodos com energia elétrica e outros sem ener",N/A,Há 10 dias
499,Descaso da concessionária com os consumidores,"Estou sem energia elétrica desde domingo à tarde dia 21.01, apesar das várias reclamações pelo telefone e pelo WhatsApp. Somos 6",N/A,Há 10 dias
500,Vocês devem me achar com cara de palhaço. Só pode.,"Entrei no chat da Light para tirar uma dúvida. Escolhi a opção falar com o atendente, porque obviamente minha dúvida não est",Respondida,Há 10 dias
501,Light está me [Editado pelo Reclame Aqui]!,"Há alguns anos tenho a tarifa social da light, benefício dado a famílias cadastradas no cadunico baixa renda, o desconto é dado po",Respondida,Há 10 dias
502,Cabela desarmando,Moro na Rua Apocalipse no Rio das Pedras e todos os dias a canela desarma. Entramos em contato com a light tanto pelo zap quando p,Respondida,Há 10 dias
503,Não consigo acessar minha conta de luz p pagar,"Me mudei de casa, meu marido colocou a conta de luz em meu nome já com endereço novo. Mudamos dia 01/12/23. Ainda não chegou nenhu",Respondida,Há 10 dias
504,Perda de equipamento,"Como sempre a luz aqui fica oscilando, caindo e voltando, dessa vez após esse cai e volta da luz, fiquei sem luz por 24 horas. Apó",Respondida,Há 10 dias
505,Quedas de luz o tempo todo,"Hoje dia 24/01/2024 as 19h deu a primeira queda de luz, são 19:55 e contei 7 quedas de luz no meu imóvel na taquara/Jacarepaguá, d",Respondida,Há 10 dias
506,FALTA DE LUZ,ESTOU A 5 DIAS SEM ENERGIA LIGUEI POR DIVERSAS VEZES PARA A LIGHT EMERGENCIAL E ATÉ AGORA NÃO COMPARECEU NENHUMA EQUIPE NA MINHA,Respondida,Há 10 dias
507,DEMORA NA VISITA TÉCNICA.,Há três dias está acontecendo picos de luz constantes em minha residência. Estou entrando em contato com Light pelo aplicativo wh,Respondida,Há 10 dias
508,Falta de luz a 2 dias,"Até agora nada da light, vir resolver o problema, casas com luz e outras sem",N/A,Há 10 dias
509,A LIGHT ESTÁ AGINDO DE FORMA DESRESPEITOSA COM OS SEU CLIENTES NA PRESTAÇÃO DOS SEUS SERVIÇOS,Boa tarde Hoje dia 24/01/2023 fizemos contato com agencia comercial da Light(Protocolo*******) para saber o motivo da,Respondida,Há 10 dias
510,Prédio inteiro sem luz a 37 horas,Desde o dia 23/01/2024 meu prédio está sem uma das fases de luz. Muitos apartamentos estão sem luz e o elevador também está parado,N/A,Há 10 dias
511,Conta de luz super faturada,"Minha conta de luz chegou com valor de R$ 327,39. Peço para a empresa reaver, pois tem algum engano. Moro sozinha, de seg a sexta",Respondida,Há 10 dias
512,Ligação da luz,"Fiz uma solicitação da ligação da minha luz na casa nova , cumpri a exigência do fio carga ,fio aterramento ,abraçadeira metálica,",Respondida,Há 10 dias
513,Declaração de quitação,"Me mudei no dia 04/01 e fiz o cancelamento do contrato com a light no dia 06/01, preciso da última conta paga e da declaração de q",Respondida,Há 10 dias
514,Estrondo de tremer as janelas e no transformador da light e sem luz há 2 horas sem carro da light e sem previsão após a light cortar as árvores do local,Estrondo de tremer as janelas e no transformador da light e sem luz há 2 horas sem carro da light e sem previsão e tudo isso após,Respondida,Há 10 dias
515,Conta paga duas vezes,"Fui pagar duas contas do mês 1 e 2 e na verdade acabei pagando a mesma conta duas vezes, só percebi quando veio o aviso de corte ,",N/A,Há 10 dias
516,"Idosa sem luz a 5 dias, diversas chamadas para a Light, péssimo atendimento ao telefone e nenhuma equipe foi resolver o problema.","Moro em Copacabana, com minha tia, idosa e com problemas de saúde. Nonultimo sábado, 20 de janeiro, ficamos sem energia, desde ent",Respondida,Há 10 dias
517,Prédio sem energia há 2 dias,"Sou morador do Prédio Edifício Residencial Mont Vert situado na Rua Antônio Cordeiro, 385 na Freguesia de Jacarepaguá no Rio de Ja",N/A,Há 10 dias
518,Leitura feita por estimativa,"Desde outubro/2023 a light vem fazendo a leitura do meu medidor por estimativa sem necessidade, pois meu medidor fica na rua com f",Respondida,Há 10 dias
519,Poste energizado ( Risco a vida),"No dia 11 de dezembro de 2023, entrei em contato com a empresa light e informei que o poste em frente a minha casa estava com fio",Respondida,Há 10 dias
520,Nao consigo usar onaplicativo light,Pedi o reset do ex email q tinha para poder acessar minhas contas sem me incomodarTodo mesTer que ligar mas ja solicit,Respondida,Há 10 dias
