id,titulo,descricao,status,data
260,Eletrodomésticos danificado,Na madrugada do dia 29/01/2024 ás 2h da manhã teve um apagão que só voltou a luz 11h da manhã e danificou minha geladeira agora a,Respondida,Há 4 dias
261,Manutenção Programada,"Fiquei sabendo pelos vizinhos,que dia 01/02 iriar ter manutenção na minha Rua:Av Belo Horizonte,Bairro São Gabriel.Poderia me envi",N/A,Há 4 dias
262,Devido aquelas constantes minha televisão queimou.,"Boa tarde! Nos dias 20, 21 e 23 de Janeiro de 2024. Houveram mais de 80 quedas de luz, sendo que no dia 23 foi onde significativam",Respondida,Há 4 dias
263,COBRANÇA ABUSIVA,O mês de janeiro foi e ainda está sendo cheio de interrupções no fornecimento de energia na Ilha do Governador e minha conta veio,Respondida,Há 4 dias
264,Um ano sem energia eletrica na minha casa!,"Há mais de um ano estou sem as três fases de energia eletrica na minha casa, as contas estam em dia, no domingo veio um profission",N/A,Há 4 dias
265,Falta de luz constante,Moro no CEP 27251310 e tda vez que chove minha rua (Manoel dos Santos Gonçalves) fica sem luz. Neste mês foram duas vzs. Uma durou,Respondida,Há 4 dias
266,Não consigo acessar minha conta na agencia virtual,Não consigo fazer login na Agência Virtual pois entra uma mensagem dizendo que meu cadastro nao existe.,Respondida,Há 4 dias
267,Sem luz,"Estou sem luz dês das 5 horas da manhã do dia 29/01 segunda-feira. Tenho criança dentro de casa, moro sozinha com meus filhos, mor",Respondida,Há 4 dias
268,Não estão fazendo a leitura do relogio GD devidamente!!!,"Desde quando foi instalado o sistema do cliente Clovis Galvão (23357947), a light está fazendo a leitura por média, ou seja, não e",Respondida,Há 4 dias
269,Protesto no Serasa,Fui protestada no Serasa com uma conta em atraso da light.Fui a um canal de atendimento e o valor ficou surreal e infe,Respondida,Há 4 dias
270,Displicência com o cliente,Houve uma reclamação relatando que um caminhão passou na minha empresa no quinta-feira 25/01/2023 e arrancou todos os fios.O,Respondida,Há 4 dias
271,"CONTAS ABSURDAS, NINGUEM ME DA UMA RESPOSTA SOBRE ALGO","DUAS CONTAS ABERTAS COM VALORES ABSURDOS, UM CONSUMO INEXISTENTE, MORO SOZINHO, TRABALHO FORA DIA INTEIRO, MINHA CASA SO TEM A GEL",Respondida,Há 4 dias
272,Não consigo acessar AGÊNCIA VIRTUAL,"Tem vários meses que não consigo acessar agência virtual devido a senha. Não consigo recuperar a mesmo, pois está cadastrado com u",Respondida,Há 4 dias
273,Projeto bônus,"A empresa light fez uma ação social na associação do meu bairro fazendo o cadastro para troca de geladeiras,ar condicionado,etc..e",Respondida,Há 4 dias
274,Queda de tensão,"Primeiro o serviço prestado pela empresa é uma bosta, ja perdi uma geladeira por conta desse problema que está acontecendo, minha",Respondida,Há 4 dias
275,Falta de luz,"Eu estou desde o dia 25/01 solicitando ligação da minha luz, foi enviado uma equipe no último sábado e eles disseram que não poder",Respondida,Há 4 dias
276,empresa falida,"a falta de luz de dias que teve na minha casa, fez minha geladeira parar, e como não consigo achar o ano que foi fabricada e não f",Respondida,Há 4 dias
277,Cobrança [Editado pelo Reclame Aqui],"A dívida já foi quitada através do programa Desenrola Brasil do Governo Federal, peço que retire as mesmas dos canais de cobranças",N/A,Há 4 dias
278,solicitação de acesso - Paulo,"Foi enviado toda a documentação para o email atendimento tecnico com a finalidade do parecer de acesso para micro geração, recebem",Respondida,Há 4 dias
279,Fios da rede pegando fogo,"Há meses que a energia tem tido quedas, é um apagar e acender de luzes sem fim.Semana passada a queda em de luz foi tanta qu",Respondida,Há 4 dias
280,"Problemas com instalação, funcionários que parecem agir de [Editado pelo Reclame Aqui].","Eu estou a mais de 1 mês tentando uma nova ligação pela light, fiz todo procedimento, os técnicos colocam reprovado, sem ao menos",Respondida,Há 4 dias
281,Cobrança abusiva,"E seguimos tendo problemas atrás de problemas com a concessionária de energia elétrica!Como dito anteriormente aqui, recente",Respondida,Há 4 dias
282,Cabo energizado em rua residencial colocando em risco a vida dos pedestres e falta de energia e sem prazo de reparo! HÁ MAIS DE 15h!!!,Ontem por volta das 19h30 passou um caminhão na rua e arrebentou todos os fios deixando os fios energizados pelo chão desencapados,Respondida,Há 4 dias
283,"Sem energia há mais de uma semana, com bebê de 9 meses e [Editado pelo Reclame Aqui] visita da equipe técnica","Fiz um pedido de religação por mudança de titularidade em 22 de janeiro, quando me informaram na agência da light em Madureira que",N/A,Há 4 dias
284,Conta com medição errada,"Bom dia, estou há 3 meses com aumento surreal na conta de luz, não fico em casa, pois eu e minha esposa trabalhamos, fiz reclamaçã",Respondida,Há 4 dias
285,Vistorias e troca do medidor em extremo atraso para Geração distribuída,"Me encontro com diversas solicitações de vistorias/ troca de medidores para geração distribuída em extremo atraso, é inadmissível",Respondida,Há 4 dias
286,Estou sem Luz e sem suporte da Light,"No dia 28/01 (Domingo) aconteceu dois estouros na fiação fora da minha residência, um estouro próximo ao poste e outro estouro pró",Respondida,Há 4 dias
287,FIO DEU CURTO E ESTOU SEM LUZ A 48 HORAS.,"Me chamo ******* Santana, sou morador do bairro de Ricardo de Albuquerque, já estou cansado de ligar pra Light vim verificar o pos",N/A,Há 4 dias
288,Sem luz desde 15:30 do dia 29/01/24,Estou desde 15:30 fazendo contato com a light para informar a falta de luz que é somente na minha residência e até agr 00:23 NINGU,Respondida,Há 4 dias
289,Não consigo redefinir a senha.,"Fiz inúmeros contatos através do call-center da light pedindo o reset do cadastro.Sempre com o prazo de reset de 24h, mas na",N/A,Há 4 dias
290,2 dias sem luz,Neste domingo dia 28/01/2024. O fio do poste foi partido devido ao temporal. estou sem luz a 2 dias ligando e nada. criança em cas,Respondida,Há 5 dias
291,Erro na cobrança de conta.,Desde que liguei meu medidor sempre paguei todas as contas porém descobri que minha Fatura digital está errada ou seja está com me,N/A,Há 5 dias
292,FALTA DE RESPEITO,Gostaria de expressar a minha INDIGNAÇÃO com relação a postura da Ouvidoria da Light. Todos sabem o transtorno que os moradores da,Respondida,Há 5 dias
293,Sem luz há mais de 12h,"Estou sem luz há mais de 12h. Meu último atendimento foi com Wesley, extremamente despreparado e mal educado. Me interrompendo vár",Respondida,Há 5 dias
294,Cancelaram o meu contrato,"Fui pedir para mudar a data do vencimento do meu contrato, e pra minha surpresa, fui informado pela atendente que o meu contrato f",Respondida,Há 5 dias
295,Descaso sem luz,"Desde o dia 25/01/24 abri uma solicitação de falta de energia na minha residencial pelo código do cliente*******, pelo protocolo**",Respondida,Há 5 dias
296,air fryer com defeito,"Realizamos o pedido junto a Light para troca do relógio para energia solar. no dia 16 de dezembro, no entanto a LIGHT não compare",Respondida,Há 5 dias
297,Solicitação Não Atendida - Carta de Anuência,"Prezados, boa noite!Gostaria de deixar registrada minha insatisfação quanto à solicitação da carta de anuência solicit",Respondida,Há 5 dias
298,Falta de Luz Ilha do governador (1),Falta de luz Estou tendo falta de luz frequente no meu bairro.Irei registrar uma reclamação para cada falta de luz.,Respondida,Há 5 dias
299,MAU-CARATISMO DO FUNCIONÁRIO,"Boa noite, prezados.Não é de hoje que solicito o aumento de carga da minha residência a vocês e sempre escuto a mesma",Respondida,Há 5 dias
300,COBRANÇA [Editado pelo Reclame Aqui],"Em 25/11/2023 paguei conta q vencia em 27/11/2023 através de PIX, e essa conta consta em aberto na light.",Respondida,Há 5 dias
301,Aumento de carga padrão trifásico,"Tentei realizar a solicitação do aumento de carga no dia 20 janeiro pela agência virtual, porém não conseguir devido a instabilida",Respondida,Há 5 dias
302,Conta muito alta,"Minha conta está vindo com um valor extremamente absurdo. Meu consumo é pouco,a minha casa é pequena moro sozinha, não tenho ch",Respondida,Há 5 dias
303,Meses com problema de energia,"Estou a meses com problema na minha energia. Depois de um transformado pegar foto, mudaram o fio da minha casa para outr transform",Respondida,Há 5 dias
304,SERASA,VENHO FAZER UMA RECLAMAÇÃO COM A LIGHT. POR FALTA DE CREDIBILIDADE E HONESTIDADE COM NÓS CONSUMIDORES. TENHO DUAS DIV,Respondida,Há 5 dias
305,Falta de energia,No dia 28/01/24 teve falta de energia na minha rua metade da rua com luz e a outra metade sem voltou por volta de meia noite.( A l,Respondida,Há 5 dias
306,Abuso,"Hoje, 29/01/2024 por volta das 09:00h esteve na minha rua uma equipe da light no veículo caminhão placa ******* a qual mexia no po",Respondida,Há 5 dias
307,Conta de luz absolutamente absurda de caro.,Boa tarde! Moro nessa residência desde abril de 2021. Desta mesma data ate novembro a de 2023 nunca paguei uma conta de energia ma,Respondida,Há 5 dias
308,Light na Ilha do Governador ..um Horror!!!!,"Ficamos sem energia hoje por cerca de 10 horas na Praia da Bandeira 563. Trabalho em homeofice, tenho uma mãe idosa (84 anos) e hi",N/A,Há 5 dias
309,Sem energia,"Estamos sem energia no prédio inteiro desde a data de ontem, 28/01/2024.Hoje, 29/02/2024; às 17H12, continuamos sem energia",N/A,Há 5 dias
310,A light cortou minha luz indevidamente.,A light cortou a eletricidade da minha residência sem chamar no portão para ver se a conta já avisa sendo paga. Quando a luz foi c,Respondida,Há 5 dias
311,Desvio de luz e cobrança abusiva!,"Há algum tempo percebo o aumento de minha luz e que sempre que meu vizinho do andar de cima liga o chuveiro ou ar condicionado, po",Respondida,Há 5 dias
312,Desta vez não é uma reclamação mas uma solicitação.,Quando entramos em contato com a light via WhatsApp não existe a opção de falta de fase então temos que registrar falta de luz o q,N/A,Há 5 dias
313,EXPLOSÃO DE BUEIRO LIGHT CAUSA TRANSTORNOS,Reclamo pela explosão e falta de manutenção nos bueiros da Light aqui em Copacabana. Ontem mais um bueiro explodiu aqui na Figueir,Respondida,Há 5 dias
314,Pagamento em duplicidade,No mês de dez/2023 paguei a conta 2 x. Não recebi o estorno e também não recebi a conta de janeiro para pagar.,Respondida,Há 5 dias
315,"PEDIDO FEITO, PAGO E ENCOMENDA NÃO ENVIADA","Conforme propaganda existente na Internet e pedido de um ventilador feito e pago, conforme comprovantes anexos, não houve envio da",Não respondida,Há 5 dias
316,CARTA DE ANUÊNCIA,"Prezados, boa tarde. Gostaria de solicitar a vocês uma carta de anuência do protesto que está em meu nome, mas que eu mesma já liq",Respondida,Há 5 dias
317,As árvores da rua não são podadas há alguns anos,"Por não ser realizada a poda nas árvores localizadas na calçada da rua há uns anos, as mesmas estão imensas dominam fiação elétric",Respondida,Há 5 dias
318,Light ignora pedidos de reparo,"Desde quinta-feira, dia 24 de janeiro, já fiz 3 pedidos de reparo na queda de fase da energia em minha residência, que me impede d",N/A,Há 5 dias
319,Preciso alterar o email,"A antiga titular da conta faleceu e eu preciso pegar a segunda via de uma conta e também passar para meu nome, mas para isso preci",Respondida,Há 5 dias
320,PARCELAMENTO SEM AUTORIZAÇÃO,"A FORNECEDORA DE ENERGIA LIGHT AUMENTOU MUITO O VALOR DA MINHA CONTA DE ENERGIA NOS MESES DE JANEIRO E FEVEREIRO, MINHA CASA SÓ",Respondida,Há 5 dias
321,Parcelamento não cobrado na conta,"Fiz um parcelamento no dia 29/12/2023 de um débito no meu apartamento, realizei o pagamento de 40% da divida no ato e parcelei o r",Respondida,Há 5 dias
322,Não consigo emitir fatura,Tenho uma conta com valor inferior a 5 reais ( saldo remanescente) do fechamento de uma titularidade. Mudei de cidade e não,Respondida,Há 5 dias
323,Corte de energia elétrica,Venho aqui mais uma vez reclamar da Light.Tive a luz cortada hoje dia 29/01/2024. A conta venceu dia 08/01/2024 e estava com,N/A,Há 5 dias
324,NÃO CONSIGO PAGAR CONTA SITE NAO FUNCIONA,Não consigo Vou comprar aqui de outra pessoa para ver se vai conta da LIGHTO APLICATIVO NÃO FUNCIONAO SITE NÃO ABRE,N/A,Há 5 dias
325,reclamacao de instalacao de relogio,"Venho aqui fazer uma reclamacao e deixar minha indguinacao pois estou tendo um problema com a light ,pois fiz um pedido para coloc",Respondida,Há 5 dias
326,Troca de titularidade,Boa tarde aluguei um imóvel fiz o contrato de locação fiz o pedido pela agência virtual da light no dia 26/01/2024 com o protocolo,N/A,Há 5 dias
327,Ligação Nova - Sem luz desde o dia 18 de janeiro,"Prezados,Venho manifestar minha insatisfação com a prestação de serviços da Light desde o dia 17 de janeiro. Realizei a solicitaçã",N/A,Há 5 dias
328,Endereço cadastrado errado e a empresa se nega a retificar o erro,"Há pelo menos 30 anos, o endereço cadastrado da minha conta de luz está como ""Fundos"", porém a minha casa é a da frente.",Respondida,Há 5 dias
329,Cobrança [Editado pelo Reclame Aqui] ( Casa Sem Poste e Relógio),"Venho através dessa informar que a residência está sem relógio e sem poste e mesmo assim a Light está enviando Faturas, Boletos e",Respondida,Há 5 dias
330,Cobrança na porta,"A light envia cobradores na nossa residência sendo que já avisado por e-mail, telefone,a data de pagamento,está causando muito con",N/A,Há 5 dias
331,Conta de energia vindo o dobro ligo e ninguém resolve,Meu consumo de energia gira em torno de 230 kWh e minha conta sem nenhum motivo aparente subiu para 430 kWh sem ter nenhum gasto,Respondida,Há 5 dias
332,Consumidor solar Robson sendo prejudicado,"A concessionária Light está cada vez mais negligente com seus serviços prestados, prejudicando o cliente solar Robson Lacerda, uma",Respondida,Há 5 dias
333,Consumidor solar Sebastião Leite sendo prejudicado,A concessionária Light está cada vez mais negligente com seus serviços e atendimentos e vem prejudicando diariamente os clientes s,Respondida,Há 5 dias
334,Solicitação de Carta de Anuência,"Preciso dar baixa em um protesto da Light no 3 Cartório de Protestos do RJ. Entrei no portal do cliente, porém não existe opção pa",N/A,Há 5 dias
335,Aniversário de um ano de falta de luz na casa da minha mãe!!!,"Estou comemorando aniversário de um ano de falta de luz na casa da minha mãe, vou comprar um bolo para comerar a GRANDE DATA, vou",N/A,Há 5 dias
336,Cobrança [Editado pelo Reclame Aqui],"Em 04/12/2023 fui informado por funcionários em minha residência que tinha uma conta em aberto no valor de R$31.042,02 referente a",Respondida,Há 5 dias
337,Troca de titularidade,"Não consigo acesso, nem obtive resposta sobre minha solicitação de troca de titularidade de conta. Essa troca realizava a mudança",Respondida,Há 5 dias
338,Não transferiu créditos de microgeração após período de dois ciclos.,"Prezados, bom dia.Informamos que o rateio não foi executado na fatura deste mês, conforme foi informado poela Light. T",N/A,Há 5 dias
339,Prazo de vistoria para instalação de energia solar expirado.,"Prezados, bom dia!No dia 17/01/2024 foi solicitada pelo engenheiro do projeto a vistoria da Light em minha residência",Respondida,Há 5 dias
340,SENHA DA LIGHT MUITO COMPLICADA,"Estou tentando acessar o APP já tem quase 20 dias e não funciona, tentei acessar a agencia virtual, pede senha tentei recuperar e",Respondida,Há 5 dias
341,Cobrança [Editado pelo Reclame Aqui],"Tendo em vista que a dívida já foi paga, pelo Programa Desenrola Brasil do Governo Federal e que já expirou o prazo para a retirad",N/A,Há 5 dias
342,Débitos inexistentes,"No mês de março recebi além da conta do mês de fevereiro , outra conta no valor de R$ 104,26, referente ao mês de janeiro. Uma fat",Respondida,Há 5 dias
343,Ritmo de Festa!!!!,"Bom, mais uma vez no escuro!Após a compra de um apartamento, fui até a empresa Light (deveria chamar Dark) no dia 20/",Respondida,Há 5 dias
344,Pagamento duplicado,Fiz um pagamento duplicado pra light.uma fatura chegou via email e outra em papel de mesmo valor.posso provar.nao foi feito nenhum,Respondida,Há 5 dias
345,Quedas de luz constantes há anos!!,A minha rua (Professor Alfredo Gomes em Botafogo) sofre um problema crônico de falta de luz há anos. As quedas de luz são constant,Respondida,Há 5 dias
346,Aumento absurdo na conta após troca de medidor,"Em novembro de 2023 foi realizada a troca dos medidores de energia pela Light, sem aviso prévio. Nós moradores apenas fomos inform",Respondida,Há 5 dias
347,Aumento abusivo,"Recebi a fatura de jan/22 com vencimento em fev/22, com um aumento absurdo de consumo de energia. Minha média está por volta de R$",Respondida,Há 5 dias
348,Conta paga,Em novembro não recebi a minha conta pelo e-mail. Peguei o código de barras pelo aplicativo e ao tentar pagar o valor estava difer,Respondida,Há 5 dias
349,Troca de titularidade,Fiz a solicitação de troca de titularidade através do site de vocês. A solicitação foi negada e pediram para eu comparecer na Agên,Respondida,Há 5 dias
350,Light vergonha nacional sem luz desde dia 25,Fui surpreendido no dia 25 do presente mês pela falta de luz na maioria dos aparelhos de minha casa por volts das 23:30. Em seguid,Respondida,Há 5 dias
351,Fio entra medidor derretendo,Estamos desde semana passada pedindo servico de vcs para trocar fio que vem da rua uma vez que o mesmo esta esquentando e ja esta,Respondida,Há 5 dias
352,Cobramca [Editado pelo Reclame Aqui],"Bom dia ! To indignada com essa empresa , estavam cortando minha energia alegando um saldo devedor de outubro ( o mesmo estando pa",Respondida,Há 5 dias
353,Atualização dados,"Realizei a atualização de dados pelo WhatsApp da Light ******* a um tempo atrás, para conseguir acesso ao aplicativo, mas sem suce",Respondida,Há 5 dias
354,Quedas de energia,Moro na rua Risoleta Caetano no bairro Engenho do Porto - Duque de Caxias. Há cinco dias houve uma falta de luz pela noite que ret,Respondida,Há 6 dias
355,Queda constante de energia elétrica,"Resido na Rua Assunção 246, Rio de Janeiro, e acho um total descalabro, sem vergonhice e desrespeito o que está acontecendo com o",Respondida,Há 6 dias
356,"Light deixando moradores da Santa Cruz em Volta Redonda sem luz, na Avenida Major Aníbal de Oliveira Filho, onde existe um transformador com problema e a Light se nega a trocar.","Toda vez que chove ou ameaça chover, nós moradores da Avenida Major Aníbal de Oliveira Filho, Santa Cruz Volta Redonda ficamos vár",N/A,Há 6 dias
357,Conta de luz com preço abusivo e atendente sem querer resolver o problema.,"Sou moradora ÚNICA de uma casa em sistema trifásico, situada no Rio de Janeiro Capital, trabalho fora de segunda à sexta-feira e p",Respondida,Há 6 dias
358,Meu rélogio está em curto e pode pegar fogo no quadro,Estou com meu relógio em curto desde o dia 20/01 e no dia seguinte 21/01eu entrei em contato com a light (protocolo*******) para r,Respondida,Há 6 dias
359,Contestar valor da conta light,"Boa noite, minhas contas de luz estão vindo muito alta sendo que não tenho ar condicionado, nem aparelhos que use muita energia go",Respondida,Há 6 dias
360,Duplicidade de pagamento,"Boa noite, Fiz o pagamento de conta referente ao mês 11/2023 duas vezes.O pagamento em duplicidade foi feito dia",Respondida,Há 6 dias
361,Corte de luz sem comunicação prévia.,É necessária a comunicação prévia e a mesma é exigida no art 91 da Resolução 456/2000.A forma e prazo para esta comuni,Respondida,Há 6 dias
362,Cobrança [Editado pelo Reclame Aqui],"Boa noite!!!Recebi minha conta de Luz para pagamento mês Janeiro e que veio me cobrando um acordo, acordo esse que não",Respondida,Há 6 dias
363,Faltou luz novamente,Bom hoje dia 28/01/2024 voltei aqui para fazer outra reclamação pois já não aguento mais isso . No dia 16/01 faltou luz dai fiquei,N/A,Há 6 dias
364,Equipamento danificado após queda de energia,"Na sexta, dia 19/01, a energia começou a ficar ruim. Os ventiladores começaram a ficar mais fracos, a geladeira ligava e desligava",Respondida,Há 6 dias
365,Recebimento de TOI indevido,Minha identificação de consumidor: Unidade consumidora: 411344695 - Titular da Unidade consumidora é meu sogro.,Respondida,Há 6 dias
366,Não consigo colocar demanda de emergência nos canais informados pela empresa,"Desde a ultima sexta-feira (hoje, domingo), estou tentando registrar uma demanda de emergência nos canais informados pela LIGHT, p",Respondida,Há 6 dias
367,Não consigo mais a conta de luz para pagar,A light não me manda mais a conta de luz para que eu possa pagar pois tenho que deslocar da onde eu moro até uma agência da light,Respondida,Há 6 dias
368,Leitura Errada do Medidor,"Neste mês, em 23/01/2034, ocorreu um equívoco na leitura do meu medidor pela funcionária da Light, que estava substituindo o habit",Respondida,Há 6 dias
369,Falta de luz,"Estou com falta de luz desde o dia 23/1/2024 às 8:00. Já fiz várias reclamações, como não fui atendida , liguei para a ouvidoria c",N/A,Há 6 dias
370,Troca de titularidade ABANDONADA,"Solicitei a troca de titularidade em junho de 2023 e até hoje, 28 de janeiro de 2024, a light não a efetuou. O ex locatário do meu",Respondida,Há 6 dias
371,A história se repete,"Quase 4 meses depois de ter um problema com a Light e ter esperado mais de uma semana p ter ele resolvido, o mesmo se repete. Minh",Respondida,Há 6 dias
372,Sem luz deis das 6 horas da manhã,"Ola me chamo Célia e gostaria de fazer uma reclamação, estou sem luz deis das 6 da manhã aqui onde eu moro ! Light vcs são uma ver",Respondida,Há 6 dias
373,"Estou negligenciado pela light, com falta de luz passando das 48h e ninguém para resolver o caso.","Estou sem luz desde SEXTA FEIRA, do qual minha residência esta sem o fornecimento e com isso, liguei diversas vezes a light com in",N/A,Há 6 dias
374,Esperando religamento há quase 2 meses,"Estou solicitando a light que religuem minha luz, pois aluguei uma casa e estou sem luz a quase dois meses, quando fui na agência",N/A,Há 6 dias
375,Sem luz a dias!!,"Estamos com falha no fornecimento de energia na cidade de Miguel Pereira/RJ a 5 dias! Meu avô de 104 anos e eu somos diabéticos,",Respondida,Há 6 dias
376,Estou sem luz a 5 dias!!!!!!!!,"Estou sem luz desde quarta feira, e sem eletricidade total. Estragou minhas comidas todas, liguei inúmeras vezes e só fala e não r",Respondida,Há 7 dias
377,"CABO DE AÇO ARREBENTADO, FIOS PARTIDOS, FIOS IMENDADOS PELA LIGHT","HÁ 6 DIAS QUE A LIGHT VEIO NO LOCAL, FALARAM QUE OUTRA EQUIPE QUE VINHA , PQ ELES NAO PODIAM FAZER NADA . ESTA UM PERIGO E SITUAÇÃ",Respondida,Há 7 dias
378,"Tinha um acordo com a light, paguei em duplicidade uma das parcelas e queria saber se a última foi quitada","Tinha um acordo com a Light, paguei a penúltima parcela em duplicidade e preciso da confirmação se a última foi abatida do crédito",Respondida,Há 7 dias
379,Falta de luz constante,"Por diversas vezes falta luz na minha casa.Acho que é por conta de um transformador.Já queimou meu freezer,o roteador e a tv está",Respondida,Há 7 dias
380,Pagamento de divida e nao retirada de protesto em cartorio,Paguei uma dívida com à light e a mesma até hoje não retirou meu protesto de cartório mesmo depois de pago a dívida,N/A,Há 7 dias
381,Atendimento para autoconsumo remoto,Após ir na agência física da light para solicitar alteração para que 100% da energia fosse direcionada para uma das instalações (0,N/A,Há 7 dias
382,Tampa do medidor opaca impossível de realizar a leitura.,Meu consumo de energia duplicou a mais de 5 meses porém nos últimos três meses subiu absurdamente onde sinalizei a light sobre al,Respondida,Há 7 dias
383,Cobrança abusiva,"Venho contestar a cobrança abusiva que veio na minha conta, minhas ultimas duas contas veio o valor 4 vezes maior do que vem, é im",Respondida,Há 7 dias
384,DATA DE VENCIMENTO fixa,"Entrei com contato com a empresa citada para poder entender como é feito o processo de datas de vencimento de conta, uma vez que e",Respondida,Há 7 dias
385,Light não liga minha energia,No dia 17 de janeiro estive numa agência da light pra fazer a transferência de luz de um imóvel pro meu nome. Assim feito. Mas pra,Respondida,Há 7 dias
386,Cadastro de uma nova instalação,Bem venho aqui passar o que eu estou vivendo pois comprei uma casa e preciso colocar uma instalação de energia. Já fiz pela,Respondida,Há 7 dias
387,Falta de luz em uma fase da rua,"Uma fase de energia na rua está com problema e sem energia, já foi feita várias reclamações desde de quinta feira dia 18/01/2024,",Respondida,Há 7 dias
388,Sem energia elétrica !Quero à solução.,Protocolo******* me foi pedido pelo Wladimir C.Gomes e foi mandado uma equipe constatando que tinha defeito e precisava de um car,Respondida,Há 7 dias
389,"Nome negativado, mesmo com as contas pagas a mais de 10 dias.",Aluguei o apartamento e quando devolvi o imóvel ao proprietário solicitei o cancelamento do contrato junto a Light (isso em 2022).,Respondida,Há 7 dias
390,Falta de energia,"Hoje dia 27/01/24 as 7h da manha todo o meu prédio tem energia e só meu apartamento está sem, chamei uma pessoa para verificar e",Respondida,Há 7 dias
391,Demora para troca de medidor,Em 24/11/2023 foi solicitado aumento de carga (trocar medidor do apartamento de monofásico para trifásico) através do protocolo***,Respondida,Há 7 dias
