id,titulo,descricao,status,data
129,Não deram baixa na conta paga,"A light está me perseguindo, não é possível tanta incompetência. Paguei a conta de luz referente ao mes de dezembro/2023 no dia 15",Respondida,Há 2 dias
130,Mais de 14h sem energia elétrica,"Bairro da Freguesia, Jacarepaguá, encontra-se desde 19:30h do dia 31/01/2024 até 12:21h, do 01/02/2024, presente momento sem forne",Não respondida,Há 2 dias
131,Tenho Um apartamento em bangu na Rua bela flor-99 apartamento 501 que está sem luz.,Estou sem luz ha 5 meses e a light não resolve nada tem que fazer uma religação do poste para dentro do pc do prédio ja foram vari,Respondida,Há 2 dias
132,Cobrança 370% acima da média histórica e a empresa diz que não!,"Fiz a reclamação inicial, no canal online da Light, indicando que o valor da cobrança estava completamente discrepante. Recebi uma",Não respondida,Há 2 dias
133,Falta de energia elétrica na maioria dos cômodos da minha residencia,"No domingo dia 28/01/2024, durante a forte chuva que caiu aqui no meu bairro, Freguesia - Jacarepaguá houve vários picos de energi",Respondida,Há 2 dias
134,falta de energia problema transformador,Ocorre que na falta de luz no meu prédio e outros três por problema no transformador a Light tem que entrar no prédio vizinho que,Respondida,Há 2 dias
135,Aumento de carga não concluído,"Pedi um aumento de carga no dia 24/01 e no sistema o prazo final para concluir o serviço era dia 31/01/2024 no caso ontem, eles nã",Não respondida,Há 2 dias
136,Luz piscando,"Durante a ultima semana de janeiro de 2024, e hoje dia 01/02/2024, a luz tem piscado constantemente. Acaba luz e volta em 30 segun",Respondida,Há 2 dias
137,12 quedas de Luz em 24 hs,"Está constante as quedas rápidas de luz. Mas nas últimas 24 hs. Aconteceu 12X, quero saber quem vai pagar meus equipamentos quando",Respondida,Há 2 dias
138,Picos de energia,"Desde ontem, dia 31/01/2024 estou tendo muitos picos de energia o dia inteiro que infelizmente se estenderam para o dia de hoje 01",Não respondida,Há 2 dias
139,Paguei duas vezes a mesma conta e não consigo contato para acertar,"Tenho duas instalações no meu nome, estou falando aqui a instalação no meu apartamento, endereço da *******, no condomínio. Pague",Respondida,Há 2 dias
140,PAGAMENTO EM DUPLICIDADE,"Minha conta vence dia 05 e esta registrada no debito automático, em janeiro a conta não foi debitada e realizei o pagamento atravé",Respondida,Há 2 dias
141,DEMORA NO PROCESSO DE AUMENTO DE CARGA PARA DOIS MEDIDORES,Bom dia.Fiz um pedido para solicitar DOIS AUMENTO DE CARGA em um PC que reformamos conforme solicitado.A L,Não respondida,Há 2 dias
142,Enganada,"Esteve na minha porta um representante da light, operador 2265282, trazendo na mao uma maquininha e falou q vinha cortar minha luz",Respondida,Há 2 dias
143,cobrança acima do usado,"Possuo uma casa na Rua Bucareste 813 casa 1 VigarioGeral, com o código de instalação da Light*******, com o nome do cliente Elinia",Respondida,Há 2 dias
144,Parcelamento de débitos,Cortaram minha luz e eu queria parcelar os débitos para conseguir quitar e restabelecer minha energia pois tenho criança pequena e,Não respondida,Há 2 dias
145,CONTA ABSURDA FORA DO NORMAL !,"Bom dia, hoje quero fazer uma reclamação sobre minha conta de luz, no condominio aonde eu moro aumentou um absurdo ou alguém está",Respondida,Há 2 dias
146,CORTE INDEVIDO DE SERVIÇOS,"Prezados,Venho por meio desta expressar minha profunda insatisfação em relação aos serviços prestados pela Light. No dia 06/",Respondida,Há 2 dias
147,FALTA DE ENERGIA A MAIS DE 12 HORAS,ONTEM DIA 31/1/2024 AS 21:3 DA NOITE FIQUEI SEM ENERGIA E EM SEGUIDA ENTREI EM CONTATO COM A LIGHT NA QUAL INFORMOU QUE A LUZ SERI,Respondida,Há 2 dias
148,FALTA DE ENERGIA,"A queda de luz esta virando rotina, esta ficando realmente complicado, pois a gente perde comida que tem que ser armazenada na gel",Não respondida,Há 2 dias
149,Falta de Energia Constante!,"Estamos com falta de energia quase que diariamente, no meu caso já perdi diversos eletrodomésticos e caso de alimentos estragados",Respondida,Há 2 dias
150,Descaso total com o consumidor,"Há meses tenho sofrido com a falta de energia toda vez que ameaça chover. em Dezembro, abri uma solicitação para poda de galhos qu",Respondida,Há 2 dias
151,CORTE SEM AVISO,"Dia 31/01 a Light cortou a minha energia sem ao menos um aviso. SMS, e-mail, telefone Há cerca de 3 meses entrei em contato com a",Não respondida,Há 2 dias
152,Contas em aberto em processo judicial,COMUNIDADE EVANGÉLICA PROJETO VIDA CNPJ: 39.559.976/0001-34 CÓDIGO CLIENTE: 20442765Código instalação: 413595828,Respondida,Há 2 dias
153,Vistoria e troca de medidor para GD em extremo atraso,"Me encontro com diversas solicitações de vistorias/ troca de medidores para geração distribuída em extremo atraso, é inadmissível",Respondida,Há 2 dias
154,DESENROLA BRASIL - LIGHT,"No dia 04/01/24 paguei a negociação que fiz através do programa do governo Desenrola Brasil, o valor de R$ 361,52 referente a dív",Não respondida,Há 2 dias
155,SEM LUZ HÁ 12 HORAS,Estou sem luz desde as 17 horas de ontem.FIO NEUTRO ROMPEU NO ENTRE O POSTE E A MINHA CASA. Fio derreteu e rompeu!,Respondida,Há 2 dias
156,Sem energia por mais de 15 horas. Atendimento te desliga na cara,"Não tenho muito a acrescentar que não esteja no título da reclamação, estamos sem energia desde ontem a tarde.Em dezem",Respondida,Há 2 dias
157,Descaso da empresa Light,Bom dia. Sou moradora do bairro de Olaria no Rio de Janeiro. Estamos sem luz desde 7:30 da manhã do dia 31/01 e até agora 08:45 do,Respondida,Há 2 dias
158,Descaso com cliente,Estamos com falta de abastecimento de luz desde 19/01 em uma das fases do nosso escritório. Essa falta de luz ocasional falta no a,Respondida,Há 2 dias
159,Instabilidade e demora excessiva no restabelecimento do serviço,"Sempre houve instabilidade no serviço na rua, mas sempre atribuí as chuvas ou ao calor excessivos. Entretanto, em uma segunda anál",Respondida,Há 2 dias
160,O chamado de emergência NÃO FUNCIONA!,"Estou desde 12h de ontem dia 31/01 sem energia na minha residência, desligaram sem mais nem menos, já fiz todas as verificações e",N/A,Há 2 dias
161,Barulho insuportável à noite,"Hoje, quinta-feira, 1 de fevereiro, por volta das 00h00, alguns trabalhadores da Luz começaram a quebrar a calçada com martelos, d",Respondida,Há 2 dias
162,ALTA DE ENERGIA ELÉTRICA HÁ 13 HORAS,"Ontem, dia 31/1, às 18:06 enviei uma solicitação à Light sobre falta de energia na rua. Moradores da rua procederam da mesma forma",Respondida,Há 2 dias
163,LIGHT NÃO ESTÁ FAZENDO MINHA LIGAÇÃO,"Solicitei ligação nova para meu apartamento no dia 17/01/2024, via internet.Até aí tudo bem, nos dias que se seguiram a equi",Não respondida,Há 2 dias
164,Falta de energia,Estou desde ontem 18h30 da noite sem energia SOMENTE na minha casa . Agora se completam 12h e eu além de trabalhar de home office,Respondida,Há 2 dias
165,Religacao da luz que não houve,"Na terça feira, dia 30/01/2024, cheguei em casa às 15:10 do trabalho e verifiquei que estava sem luz, daí então fui verificar o re",Respondida,Há 2 dias
166,Outra reclamação mesmo problema de falta de respeito,Gostaria de pontuar a falta de respeito da Light com os consumidores.Moro no 9 andar de um prédio na Tijuca - Rio de J,Não respondida,Há 2 dias
167,Falta de luz e oscilações de fase em todos santos,"É recorrente a falta de luz e oscilações de fases na região de Todos os Santos, Meier e Cachambi. Há inúmeros relatos de pessoas c",Respondida,Há 2 dias
168,Desrespeito com o cliente,Mais uma vez a Lught me traz grandes problemas. Hoje o técnico esteve na minha residência para informar que a luz seria cortada.,Respondida,Há 2 dias
169,Falta de luz recorrente,Moro no entorno do Riocentro e constantemente falta energia no condomínio onde moro. A falta de energia é somente no condomínio Ba,Respondida,Há 3 dias
170,Não cumprimento do prazo de religação,"Fui a light solicitação a religação da luz, foi dado o prazo de 2 dias para que o serviço fosse feito. Os 2 dias se passaram e o s",Respondida,Há 3 dias
171,Pagamento conta light vis QR Code caiu no banco Cora,"No dia 01/12/23 realizei o pagamento de uma conta de energia da Light no valor de R$ 73,42 via QRCode e caiu como destinatário o b",Respondida,Há 3 dias
172,FALTA DE ENERGIA ELÉTRICA É CONSTANTE,Eu moro aqui na praia do cardo em Sepetiba na rua coronel Moura Dias 4a a falta de energia elétrica é constante a toda semana falt,N/A,Há 3 dias
173,Religação de Energia Light,A Light alegou ter uma conta em débito na última segunda feira dia 29 de janeiro ( a qual já estava paga!!!!!!!) Foi paga no dia 2,Respondida,Há 3 dias
174,Dívida negativada,"Então, eu estava em débito com vcs e fiz uma negociação no dia 5 de janeiro e paguei a primeira parcela! e já estamos em 31 de jan",Respondida,Há 3 dias
175,o sistema tá sempre fora pra me ajudar.,"Estou com duas contas atrasadas e mais uma que ainda vai vencer. Estou a mais de um mês, tentando fazer o parcelamento e todo dia",Respondida,Há 3 dias
176,Falta de luz continua,"Gostaria de registrar o péssimo serviço prestado pela companhia na localidade do CEP 25809-604, em três rios(rua dos ipes e Tavar",Respondida,Há 3 dias
177,FALTA DE LUZ + de 24h,"Já não é a primeira vez, isso tem acontecido COM MUITA RECORRÊNCIA NA RUA MOURA BRITO NA TIJUCA. NA ÚLTIMA VEZ FORAM 3 dias SEM LU",Respondida,Há 3 dias
178,Desrespeito com consumidor,"A light distribuiu comunicado ontem avisando que seria interrompido o fornecimento de energia, hoje,31/01/2024 , em algumas rua do",Respondida,Há 3 dias
179,Reclamação sobre Cobrança [Editado pelo Reclame Aqui] - Conta de Energia,"Prezada Light,Eu, Fábio J. Santos, venho por meio desta expressar minha discordância em relação à cobrança presente em",Não respondida,Há 3 dias
180,Corte de energia indevido,Estava com a conta do mês de Dezembro 23 em atraso e a de Janeiro iria vencer no dia 30/2024.No dia 30/01/24 efetuei o pagam,Respondida,Há 3 dias
181,Light - Transformou a Ilha do Gov. em um inferno,A light está fazendo os moradores da Ilha do Governador viverem o inferno na terra desde o início do mês de Janeiro. Hoje levei 1,Respondida,Há 3 dias
182,Não consigo acessar agencia virtual,Estou sem acesso a agência virtual e não consigo realizar nenhum serviço pelo WhatsApp porque está sempre fora do ar e manda nova,Não respondida,Há 3 dias
183,Prestação de serviço horrível,"Moro em Engenheiro Paulo de Frontin no bairro Morro Azul e já fazem anos, digo mais 20 anos que não pode nem o tempo fechar que ac",Respondida,Há 3 dias
184,Fatura por estimativa e valor altíssimo,"O CONDOMÍNIO BOTANIQUE 211, cliente da empresa GSB Energia Solar LTDA e proprietário da unidade consumidora******* (venc.: 19/02/2",Respondida,Há 3 dias
185,"Sem luz na rua, fase ruim, sem luz no predio!","Sou moradora da Rua Moira Brito, na Tijuca. Ontem a noite ficamossem.uma fase. Parece que o problema é na rua. O predio sem elevad",N/A,Há 3 dias
186,Acidente com 3 postes da light,No dia 18/01/2024 estava trabalhando de motoboy passei pelo bairro de São Francisco-Belford Roxo por volta de 17:20/17:40 e aconte,Não respondida,Há 3 dias
187,Light se nega a fazer atualização cadastral do imóvel.,Comprei um imóvel da Caixa Econômica e fiz contato com o 0800 da Light solicitando o procedimento que devo ter em relação ao cadas,Respondida,Há 3 dias
188,Declaração de quitação Light,Precoso com urgência de uma declaração de quitação de débitos de 2023 da Light mas é impossível conseguir porque o calendário dele,N/A,Há 3 dias
189,Light Deixa Rua na Barra da Tijucaa com varias casas sem uma das fases gerando prejuizo,"Bom diaPor favor, leiam com atenção.Desde o dia 25/01/24 por volta das 23:30 uma fase do disjuntor trifasico caiu e a",Respondida,Há 3 dias
190,FAZENDO CONSUMIDOR DE BESTA,"Estou com débitos nas duas instalações que possuo e com isso, tive minha energia cortada com 49 dias de atraso dia 29/01.Dia",Respondida,Há 3 dias
191,Empresa não detalha os créditos usados na unidade compensação,"Na fatura a light não informa quantos de créditos de energia injetada foram utilizados no abatimento da conta , e não detalha val",Respondida,Há 3 dias
192,Desligaram meu relógio com tudo pago em dia,O relógio está desligado e estou sem energia elétrico por dois dias.Já liguei incansavelmente para o serviço de atendimento,N/A,Há 3 dias
193,Dificuldade para conseguir a declaração de quitação de débitos,"Há algum tempo solicitei o cancelamento do contrato de energia referente ao endereço R MARIO AGOSTINELLI 50 BL 1 AP 1205 GR 1.4, B",Respondida,Há 3 dias
194,NOME NEGATIVADO MESMO JÁ PAGO,"A Light negativou meu nome e eu fiz o pagamento, no site do Serasa e na ouvidoria o pagamento já constou, porém a light se recusa",Respondida,Há 3 dias
195,Apagões constantes na Ilha do Governador,Eu e tantos outros moradores e comerciantes da Ilha temos vivido transtornos constantes com constantes apagões de longas horas e o,N/A,Há 3 dias
196,Falta de Luz Ilha do governador (2),Falta de luz Estou tendo falta de luz frequente no meu bairro.Irei registrar uma reclamação para cada falta de luz.,Respondida,Há 3 dias
197,Nome negativado indevidamente no serasa,Acessei o serasa limpa nome e consta uma divida negativada no meu niome. Vi que foi registrado por: LIGHT SERVICOS DE ELETRICIData,Não respondida,Há 3 dias
198,Falta de energia,"Estou tendo problemas recorrentes com a light, só esse mês o poste já estornou 4x. Mas o problema maior é a falta de empatia da li",Respondida,Há 3 dias
199,Pix no aplicativo da light falso,"Entrei no aplicativo da light , não foi site foi o próprio aplicativo onde precisa até de senha para entrar e gerou um cód pix par",Respondida,Há 3 dias
200,Contas Vencimento NOV23 constam pendentes no site da Light,Bom dia. Paguei 3 contas do mes NOV23 para mim estava tudo certo. Em JAN24 descobri um problema referente a quem recebeu os pagame,Respondida,Há 3 dias
201,Light me faz cobrança sem expor a clareza do motivo pelo qual essa cobrança está existindo,A Light está me fazendo uma cobrança sem deixar claro o porque da cobrança quanto a Fatura referente a Janeiro de 2024 (que se ven,Respondida,Há 3 dias
202,Medidor impossível de vizualizar número pra leitura,Venho fazer uma reclamação. Solicitei a aferição do medidor devido altos valores na minha conta de energia. Fui olhar no medidor p,Não respondida,Há 3 dias
203,Pagamento realizado e dívida não removida do Serasa,"Fiz o pagamento de uma dívida que estava no serasa no nome da minha avó e mesmo após o pagamento já constar, a Light se recusa a t",Respondida,Há 3 dias
204,Descaso total com cliente,"No dia 31/12/2023 o fio do poste que alimenta nosso comércio e o medidor, pegaram fogo. Foi feito nesse dia contato com a emergênc",Respondida,Há 3 dias
205,FURTO DE ENERGIA ELÉTRICA,"Bom dia!Gostaria de uma orientação.A dois meses venho reparado num pique de luz sempre ao final da tarde para noite, e",Respondida,Há 3 dias
206,Dívida protestada,Minha dívida já está paga a meses e eles ainda não tiraram do Serasa o protesto . Solicito por gentileza que retirem meu nome do p,Respondida,Há 3 dias
207,conta muito alta,"no dia 12 de dezembro de 2023 liguei para light para contestar o valor dessa fatura, sou baixa renda , e ate a data de hoje nada f",Respondida,Há 3 dias
208,solicitação de parecer de acesso - elizabeth,"Enviamos todos os documentos para o atendimento e no dia 12 de janeiro, recebemos o protocolo *******, até hoje não recebemos o pa",Respondida,Há 3 dias
209,Não consigo falar com um atendente para solicitar Declaração de data da ligação de energia no meu imóvel,Estou precisando de uma Declaração ou Certidão da Light de data da ligação da energia elétrica no meu imóvel mas não consigo falar,Respondida,Há 3 dias
210,Nome protestado após o pagamento e solicitação de carta de anuência.,"Ocorre que em 06/01/2024 tomei ciência através do app do SERASA que um título havia sido colocado em protesto, em busca de maiores",Respondida,Há 3 dias
211,Conta paga,Paguei uma conta de 300 e pouco reais l em 4 de dezembro de 2023 e estamos entrando em fevereiro e até agora nada de constar no si,Respondida,Há 3 dias
212,Quedas de energia diariamente,"Desde novembro/2023 minha residência sofre com quedas diárias de energia. Algumas ocorrem durante apenas alguns segundos, e às vez",Respondida,Há 3 dias
213,Cobrança exorbitante,"De acordo com o meu histórico de consumo, venho observando que a concessionária vem realizando cobranças absurdas na minha conta",Respondida,Há 3 dias
214,LIGHT NÃO ACEITA PAGAMENTO NO CARTÃO DE CRÉDITO,"SEMPRE QUANDO TENTO PAGAR NO CARTÃO DE CRÉDITO, APARECE A SEGUINTE MENSAGEM: ""Ops! Acont",N/A,Há 3 dias
215,Falta de luz,"Desde as 3:30 do dia 30/01/2024, estou sem luz. Fiz várias ligações, para tentar resolver o problema, mais nada foi feito. A luz n",Respondida,Há 3 dias
216,Sem luz,Desde as 11hs do dia 30 d janeiro estamos com um problema de falta de luz por conta de um relógio blindado que a light instalou no,Respondida,Há 3 dias
217,Descaso com o consumidor,Desde de setembro de 2023 não recebo conta física desta empresa. Já fiz diversas reclamações para a ouvidoria e nada. Falam que vã,Respondida,Há 3 dias
218,"Sem energia só na minha casa, sem nenhum motivo","Cheguei em casa com minha mãe e minha filha, por volta das 19 hrs e verificamos que estava sem energia, liguei para Light e inform",Respondida,Há 3 dias
219,PAGAMENTO PELO CARTAO DE DEBITO FOI CREDITADO NA MINHA CONTA MAS NO APP DA LIGHT NÃO,"Fiz meu pagamento dia 26/01/2023 pelo app da light, foi debitado no meu cartao de debito certinho o valor, mas eu fico entrando to",Respondida,Há 3 dias
220,Ligação Nova,"Meu esposo solicitou uma ligação nova no dia 17/01/2024, protocolo*******, deram o prazo de 10 dias e até agora não fizeram a perí",Respondida,Há 3 dias
221,Tampa.do.medidor.e tampa. Quebrada. E. Lacre rompido. Do.medidor. Essa.obra. Feito.por.proprio.funcionarios da.light,Bem. Semana. Passada. Dois funcionários. Da light. Chamara. Pela.titular.da.conta sendo que ela não estava nem o filho dela.,Respondida,Há 3 dias
222,Contestar conta de luz,"Boa noite, mais uma vez venho aqui contestar o valor de outra conta de luz, na minha casa nada mudou, não tem ar condicionado, não",Respondida,Há 3 dias
223,Rede com tensão mínima menor que o aceitável.,"Abri 3 reclamações junto à Light e uma junto à Aneel, sobre o problema:Uma das fases as vezes, oscila até chegar abaix",Respondida,Há 4 dias
224,Meia fase,"Na Lucio Costa , perto do Bobs e do Adorê estamos com meia fase.",Respondida,Há 4 dias
225,Quero um acordo,"Boa noite, no momento estou residindo no apartamento que minha mãe morava porém existe uma conta no qual tem que da uma entrada d",Respondida,Há 4 dias
226,Descaso de atendimento resultando em possíveis riscos de vida.,"Houve queda na fase da minha residência, e o poste em frente a ela entrou em curto circuito e ficou prestes a incendiar, impedindo",Respondida,Há 4 dias
227,gerador,"no dia 27/01 foi instalado em frente à minha casa um gerador enorme que além de soltar um cheiro forte de combustível, produz um b",Respondida,Há 4 dias
228,Descaso,"Falta de luz no bloco , existe um armário que apenas equipe autorizada tem a chave para mexer, desde 12:30 sem energia, e nada se",Respondida,Há 4 dias
229,Apagões diários,"Moro no Recreio dos Bandeirantes-RJ,CEP.22795-090 e, diariamente, principalmente a noite e sem quaisquer motivos aparentes tipo ch",Respondida,Há 4 dias
230,Queda de luz constantes,Venho expressar minha insatisfação com as constantes quedas de energia que tenho enfrentado em minha residência nas últimas semana,Respondida,Há 4 dias
231,Cobrando Absurdamente,"Estou dois meses em uma nova casa, e o segundo mês veio mais de 3x o valor da conta antiga. Sendo que, viajei durante uma semana n",Respondida,Há 4 dias
232,EXCLUIR CONTA/EMAIL DA AGÊNCIA VIRTUAL LIGHT,Boa noite! Gostaria de excluir uma conta/email da Agência Virtual Light. O usuário utiliza meu email e gostaria de excluí-lo,Respondida,Há 4 dias
233,Falta de luz,Olá boa tarde Estou sem energia desde ontem 29/01/24 por volta das 17hrs Tô com meu filho de 7 anos recém operado em c,N/A,Há 4 dias
234,Oscilação de luz na casa há 3 dias,Há 3 duas minha casa está oscilando energia. Moro com um idoso de 83 anos e recebi minha prima autista nesse período e não pude of,Não respondida,Há 4 dias
235,Falta de luz e baixa voltagem,"Estou a mais de 1 ano reclamando que a voltagem que recebo em minha casa é abaixo do permitido, várias equipes da light já constat",Não respondida,Há 4 dias
236,Fornecimento de Energia inadequado,"Solicitações de fornecimento de energia ruim (apenas 1 fase, nao funciona tomadas 220v do apartamento..). Sem atendimento tecnico,",Não respondida,Há 4 dias
237,Pedido de pensão alimentícia na folha de pagamento,Boa noite. Desde o ano passado entrei com pedido de pensão alimentícia. O juiz determinou no dia 14/11/23 o pagamento direto,Não respondida,Há 4 dias
238,Minha conta de luz de 2 meses para cá está vindo um absurdo,"Moro sozinha fico o dia todo fora e minha conta quase triplicou , nesse presente momento, venho relatar a cobrança por estimativa",Não respondida,Há 4 dias
239,Conta de luz exageradamente alta,"Moro em uma casa que moram 3 pessoas, com 8 bicos de luz, não usamos ar condicionado, tenho uma geladeira, chuveiro elétrico, um c",Não respondida,Há 4 dias
240,Sem energia novamente,Nesse exato momento estou sem energia novamente . Faltou energia no domingo fiz a reclamação nessa plataforma e agora no dia 30/01,Não respondida,Há 4 dias
241,Demora na e lzexub,A luz acabou aqui no meu estabelecimento no Domingo dia 28/01 as 23h.Foram realizadas inúmeras tentativas e diversos chamado,Não respondida,Há 4 dias
242,LIGHT trocou o relógio de energia e a conta de luz triplicou,"Por volta de Agosto/Setembro de 2023 a LIGHT trocou o relógio da minha mãe, uma senhora de 80 anos de idade, que mora sozinha e co",Não respondida,Há 4 dias
243,Falta de luz,"Boa tarde, estou desde sexta feira sem luz por inadimplência, na sexta mesmo dei um jeito e paguei as contas em atraso. Me avisara",Não respondida,Há 4 dias
244,Não consigo trocar meu nome,Estou tentando alterar meu nome na conta de casada para solteira e não consigo.,Respondida,Há 4 dias
245,Ressarcimento de danos,Na data de 17/11/23 meu aparelho de ar condicionado foi danificado pela empresa Light. Após cumprir todas as solicitações da empre,Respondida,Há 4 dias
246,RAMAL PARTIDO e site impossivel de registrar ocorrência,"Boa tarde, o ramal TRIFÁSICO, se encontra em curto e partido em uma emenda já feita pela própria light. Com as fortes chuvas dos ú",Não respondida,Há 4 dias
247,Aumento de carga,"Depois de várias tentativas sem êxito, inclusive por aqui, ja foram feitas todas as alterações e correções exigidas! Precisamos de",Não respondida,Há 4 dias
248,LIGHT NÃO PRESTA SERVIÇOS BÁSICOS E NEGLIGENCIA CLIENTES,Gostaria de denunciar o descaso que venho sofrendo por parte da Light. Um serviço que era pra ser prestado há quase 1 mês (20 dias,Não respondida,Há 4 dias
249,Nem a ouvidoria da Light entende que a conta está paga,"Consta na agencia virtual Light uma conta de luz com vencimento em 10/11/2023, no valor de R$895,69 (que porém não possui código d",Não respondida,Há 4 dias
250,Conta paga em Duplicidade,"Olá, eu paguei a minha conta de dezembro em Duplicidade, liguei hoje duas vezes e consegui resolver mandando eu ligar novamente em",Não respondida,Há 4 dias
251,O suplício da ligação nova,Eu pedi uma ligação nova para a Light no dia 23 de janeiro. Eles deram cinco dias úteis para fazer a vistoria e a ligação.,Respondida,Há 4 dias
252,Cobrança de religação sem ter cortado a luz,"A conta do mês de dezembro foi paga em atraso no dia 29/12/23 (vencimento 11/12/23), conta de janeiro paga normalmente. Esse perío",Respondida,Há 4 dias
253,Galhos das árvores,"Boa tarde, moro em Bangu/RJ, em frente a uma praça cheia de árvores, que estão com os galhos muito altos, encostando nos fios de e",Respondida,Há 4 dias
254,FALTA DE LUZ A MAIS DE UMA SEMANA (INSTABILIDADE DE ENERGIA),"Nesse mês de Janeiro ,eu e meus vizinhos já perdemos as contas de quantas vezes ligamos e reclamamos na Light a semana toda estamo",Respondida,Há 4 dias
255,LIGHT NAO DISCRIMINA ENERGIA CONSUMIDA DA ENERGIA DISTRIBUIDA E TRANSMITIDA,Preciso dos dados separados de energia distribuida e transmitida e o respectivo ICMS cobrado em cada uma dela para poder prossegui,Respondida,Há 4 dias
256,Sem resposta no pedido de troca de titularidade,"Fiz pedidos de troca de titularidade em 08/01/24 e em 16/01/24, recebi e-mail confirmando o recebimento dos pedidos, que estavam e",Respondida,Há 4 dias
257,Falta de energia,"Estou sem luz a 3 dias e mesmo reclamando na ouvidoria da light, não resolveu meu problema, fiz uma reclamação também na aneel, e",N/A,Há 4 dias
258,Falta de organização e consideração pelo cliente,"No dia 31/10/2023 e no dia 01/11/2023, dei entrada em um pedido de solicitação de acesso, para a geração distribuída de duas usina",Respondida,Há 4 dias
259,Corte de luz sem aviso,Recebi no dia 30/01/2024 um SMS alertando sobre a pendência de pagamento na fatura que venceu em 02/01/2024. No mesmo momento tent,N/A,Há 4 dias
